German_Headword	Dutch_Headword	English_Headword	German_IPA	Dutch_IPA	English_IPA	German_Sound_Classes	Dutch_Sound_Classes	English_Sound_Classes	Cognateset_ID
Stuhl	stoel	stool	ʃ t uː l	s t uː l	s t uː l	S T V R	S T V R	S T V R	519
Stock	stok	stock	ʃ t ɔ k	s t ɔ k	s t ɔ k	S T V K	S T V K	S T V K	521
Schleim	slijm	slime	ʃ l ai m	s l ɛɪ m	s l aɪ m	S R V M	S R V M	S R V M	524
Mann	man	man	m a n	m ɑ n	m æ n	M V N	M V N	M V N	529
weben	weven	weave	v eː b ə n	ʋ eː v ə	ʋ iː v	W V P V N	W V W V	W V W	530
